{"$comment":"sv0cov.doctor 1.0 (SPEC 20.7). Probe registry order, applicability, dependency skipping, exact pass facts, diagnostic correspondence, summary derivation, embedded-object validity, and the self-digest are semantic checks.","$defs":{"digest":{"maxLength":64,"minLength":64,"type":"string"},"doctor":{"additionalProperties":false,"properties":{"compatibility_policy":{"anyOf":[{"type":"null"},{"$ref":"sv0cov.compatibility-1.0.schema.json#/$defs/policy"}]},"diagnostics":{"items":{"$ref":"sv0cov.diagnostic-1.0.schema.json#/$defs/record"},"maxItems":18,"type":"array"},"doctor_sha256":{"$ref":"#/$defs/digest"},"mode":{"enum":["standalone","toolchain"]},"probes":{"items":{"$ref":"#/$defs/probe"},"maxItems":18,"minItems":18,"type":"array"},"schema":{"const":"sv0cov.doctor"},"status":{"enum":["fail","pass"]},"summary":{"additionalProperties":false,"properties":{"failed":{"maximum":18,"minimum":0,"type":"integer"},"not_applicable":{"maximum":18,"minimum":0,"type":"integer"},"passed":{"maximum":18,"minimum":0,"type":"integer"},"skipped":{"maximum":18,"minimum":0,"type":"integer"},"total":{"maximum":18,"minimum":0,"type":"integer"}},"required":["failed","not_applicable","passed","skipped","total"],"type":"object"},"toolchain":{"anyOf":[{"type":"null"},{"additionalProperties":false,"properties":{"root_revision":{"anyOf":[{"type":"null"},{"maxLength":40,"minLength":40,"type":"string"}]},"root_worktree":{"enum":["clean","dirty","unavailable"]},"submodule_revision":{"anyOf":[{"type":"null"},{"maxLength":40,"minLength":40,"type":"string"}]},"submodule_worktree":{"enum":["clean","dirty","unavailable"]}},"required":["root_revision","root_worktree","submodule_revision","submodule_worktree"],"type":"object"}]},"version":{"const":"1.0"},"version_manifest":{"$ref":"sv0cov.version-1.0.schema.json#/$defs/manifest"}},"required":["compatibility_policy","diagnostics","doctor_sha256","mode","probes","schema","status","summary","toolchain","version","version_manifest"],"type":"object"},"fact":{"additionalProperties":false,"properties":{"name":{"maxLength":64,"minLength":1,"type":"string"},"value":{"anyOf":[{"type":"null"},{"type":"boolean"},{"maximum":9223372036854775807,"minimum":-9223372036854775808,"type":"integer"},{"maxLength":4096,"minLength":0,"type":"string"}]}},"required":["name","value"],"type":"object"},"probe":{"additionalProperties":false,"properties":{"blocked_by":{"items":{"maxLength":4,"minLength":4,"type":"string"},"maxItems":17,"type":"array"},"diagnostic_code":{"anyOf":[{"type":"null"},{"maxLength":7,"minLength":7,"type":"string"}]},"facts":{"items":{"$ref":"#/$defs/fact"},"maxItems":3,"type":"array"},"id":{"maxLength":4,"minLength":4,"type":"string"},"status":{"enum":["fail","not_applicable","pass","skipped"]}},"required":["blocked_by","diagnostic_code","facts","id","status"],"type":"object"}},"$ref":"#/$defs/doctor","$schema":"https://json-schema.org/draft/2020-12/schema"}
