{"compatibility_policy":null,"diagnostics":[],"doctor_sha256":"fcd5f86ee170ee1025bc785de137b5b37dc4ceecde19966528a303fe1bba90dd","mode":"standalone","probes":[{"blocked_by":[],"diagnostic_code":null,"facts":[{"name":"manifest_sha256","value":"ca7b403f95b32509d58f70ac688fab9bdbeda39a7ee88fffa279bf28740a292d"}],"id":"D001","status":"pass"},{"blocked_by":[],"diagnostic_code":null,"facts":[{"name":"registry_revision","value":2},{"name":"registry_sha256","value":"1c2cd283986f9474f0e51196d969ed9fd57f48f29ba9704a00e76b9175ed917f"}],"id":"D002","status":"pass"},{"blocked_by":[],"diagnostic_code":null,"facts":[{"name":"validated_schema_count","value":13}],"id":"D003","status":"pass"},{"blocked_by":[],"diagnostic_code":null,"facts":[{"name":"validated_member_count","value":82}],"id":"D004","status":"pass"},{"blocked_by":[],"diagnostic_code":null,"facts":[{"name":"host","value":"macos-arm64"}],"id":"D005","status":"pass"},{"blocked_by":[],"diagnostic_code":null,"facts":[{"name":"language","value":"python"},{"name":"runtime_name","value":"cpython"},{"name":"runtime_version","value":"3.13.0"}],"id":"D006","status":"pass"},{"blocked_by":[],"diagnostic_code":null,"facts":[],"id":"D007","status":"pass"},{"blocked_by":[],"diagnostic_code":null,"facts":[{"name":"validated_member_count","value":2}],"id":"D008","status":"pass"},{"blocked_by":[],"diagnostic_code":null,"facts":[],"id":"D009","status":"not_applicable"},{"blocked_by":[],"diagnostic_code":null,"facts":[],"id":"D010","status":"not_applicable"},{"blocked_by":[],"diagnostic_code":null,"facts":[],"id":"D011","status":"not_applicable"},{"blocked_by":[],"diagnostic_code":null,"facts":[],"id":"D012","status":"not_applicable"},{"blocked_by":[],"diagnostic_code":null,"facts":[],"id":"D013","status":"not_applicable"},{"blocked_by":[],"diagnostic_code":null,"facts":[],"id":"D014","status":"not_applicable"},{"blocked_by":[],"diagnostic_code":null,"facts":[],"id":"D015","status":"not_applicable"},{"blocked_by":[],"diagnostic_code":null,"facts":[],"id":"D016","status":"not_applicable"},{"blocked_by":[],"diagnostic_code":null,"facts":[],"id":"D017","status":"not_applicable"},{"blocked_by":[],"diagnostic_code":null,"facts":[],"id":"D018","status":"not_applicable"}],"schema":"sv0cov.doctor","status":"pass","summary":{"failed":0,"not_applicable":10,"passed":8,"skipped":0,"total":18},"toolchain":null,"version":"1.0","version_manifest":{"artifact_versions":{"coverage_map":["1.0"],"diagnostic":["1.0"],"diagnostic_registry":["1.0"],"export_manifest":["1.0"],"indexed":["1.0"],"indexed_semantic":["1.0"],"native_report":["1.0"],"raw_profile":["1.0"],"resolved_configuration":["1.0"],"run_set":["1.0"],"vm_binding":["1.0"],"vm_covr":["1.0"]},"backends":["native","vm-v1"],"bytecode_profiles":["sv0vm-v1-coverage"],"commands":["version"],"diagnostic_registry":{"revision":2,"sha256":"1c2cd283986f9474f0e51196d969ed9fd57f48f29ba9704a00e76b9175ed917f"},"features":[],"host":{"architecture":"arm64","operating_system":"macos"},"implementation":{"language":"python","revision":"aaaaaaaaaaaaaaaaaaaaaaaaaaaaaaaaaaaaaaaa","runtime":{"name":"cpython","version":"3.13.0"}},"manifest_sha256":"ca7b403f95b32509d58f70ac688fab9bdbeda39a7ee88fffa279bf28740a292d","schema":"sv0cov.version","supported_hosts":["linux-arm64","linux-x86_64","macos-arm64","macos-x86_64"],"supported_python_versions":["3.13","3.14"],"tool":{"name":"sv0cov","version":"0.1.0"},"version":"1.0"}}
